ID	Name	Name translation	Description	Description translation
94	Holy Word	Священное Слово	Inflicts unresistable damage on each evil monster within line of sight, cures 1000 points of damage, cures all stunning, heals all cut damage, neutralizes poison, and removes fear.	Inflicts unresistable damage on each evil monster within line of sight, cures 1000 points of damage, cures all stunning, heals all cut damage, neutralizes poison, and removes fear.
95	Detect Monsters	Поиск Монстров	Detects all non-invisible monsters in the immediate area, for one turn only.	Detects all non-invisible monsters in the immediate area, for one turn only.
96	Detection	Поиск	Detects all treasure, objects, doors, stairs, traps, and monsters in the immediate area.	Detects all treasure, objects, doors, stairs, traps, and monsters in the immediate area.
97	Identify	Идентификация	Reveals the powers of an object.	Reveals the powers of an object.
98	Probing	Анализ Монстра	Probes each monster within line of sight, giving information on the current hit points of the monster and many of its characteristics and abilities (excluding its melee, spellcasting, and breath attacks).	Probes each monster within line of sight, giving information on the current hit points of the monster and many of its characteristics and abilities (excluding its melee, spellcasting, and breath attacks).
99	Clairvoyance	Ясновидение	Lights up, maps out, and detects all objects on the complete current dungeon level.	Lights up, maps out, and detects all objects on the complete current dungeon level.
100	Cure Serious Wounds	Лечение Серьезных Ран	Cures 20% of your wounds (min 25hp) and heals all cut damage.	Cures 20% of your wounds (min 25hp) and heals all cut damage.
101	Cure Mortal Wounds	Лечение Смертельных Ран	Cures 30% of your wounds (min 50hp), cures all stunning and heals all cut damage, poison and amnesia.	Cures 30% of your wounds (min 50hp), cures all stunning and heals all cut damage, poison and amnesia.
102	Healing	Исцеление	Cures 2000 points of damage, cures all stunning and heals all cut damage.	Cures 2000 points of damage, cures all stunning and heals all cut damage.
103	Restoration	Восстановление	Restores to maximum all stats that are currently below maximum.	Restores to maximum all stats that are currently below maximum.
104	Remembrance	Воспоминания	Restores experience points to maximum if it is currently below maximum.	Restores experience points to maximum if it is currently below maximum.
105	Dispel Undead	Уничтожение Мертвецов	Inflicts unresistable damage on each undead monster within line of sight.	Inflicts unresistable damage on each undead monster within line of sight.
106	Dispel Evil	Уничтожение Зла	Inflicts unresistable damage on each evil monster within line of sight.	Inflicts unresistable damage on each evil monster within line of sight.
107	Banish Evil	Изгнание Зла	Teleports away each evil monster within line of sight.	Teleports away each evil monster within line of sight.
108	Word of Destruction	Слово Разрушения	Destroys everything in a 15-square radius circle around you.  All monsters, objects, and terrain features in the area of effect are destroyed, except stairs and permanent walls.  You will also be blinded for 10+1d10 turns, unless you have resistance to blindness or light.  This prayer has no effect when used in the town.	Destroys everything in a 15-square radius circle around you.  All monsters, objects, and terrain features in the area of effect are destroyed, except stairs and permanent walls.  You will also be blinded for 10+1d10 turns, unless you have resistance to blindness or light.  This prayer has no effect when used in the town.
109	Annihilation	Аннигиляция	Inflicts 200 points of damage on a single monster that is not undead, a demon, an elemental, a golem, or a vortex.	Inflicts 200 points of damage on a single monster that is not undead, a demon, an elemental, a golem, or a vortex.
110	Unbarring Ways	Открытые Пути	Destroys all traps and doors within a 1-square radius of you.	Destroys all traps and doors within a 1-square radius of you.
111	Recharging	Перезарядка	Adds charges to a stack of wands or staves.  Chance of success and number of charges gained increase with your level and decrease with level of wand or staff and number of charges.  A failed attempt to recharge destroys one wand or staff from the stack.	Adds charges to a stack of wands or staves.  Chance of success and number of charges gained increase with your level and decrease with level of wand or staff and number of charges.  A failed attempt to recharge destroys one wand or staff from the stack.
113	Enchant Weapon	Зачарование Оружия	Attempts to improve the to-hit bonus and the to-dam bonus of a weapon. Also gives a chance to break a curse.	Attempts to improve the to-hit bonus and the to-dam bonus of a weapon. Also gives a chance to break a curse.
114	Enchant Armour	Зачарование Доспехов	Attempts to improve the armour class bonus of a piece of armour. Also gives a chance to break a curse.	Attempts to improve the armour class bonus of a piece of armour. Also gives a chance to break a curse.
115	Elemental Brand	Клеймо Элементов	Brands the currently wielded melee weapon with fire (50%) or cold (50%), and at the same time attempts to improve the to-hit bonus and the to-dam bonus of the same weapon.  The prayer has no effect if the weapon is an artifact or ego item, is already branded, has a slay, is broken, or is cursed.	Brands the currently wielded melee weapon with fire (50%) or cold (50%), and at the same time attempts to improve the to-hit bonus and the to-dam bonus of the same weapon.  The prayer has no effect if the weapon is an artifact or ego item, is already branded, has a slay, is broken, or is cursed.
116	Blink	Скачок	Teleports you randomly up to 10 squares away.	Teleports you randomly up to 10 squares away.
117	Teleport Self	Телепортация	Teleports you randomly within the current level.	Teleports you randomly within the current level.
118	Teleport Other	Телепортация Монстра	Produces a bolt that teleports the first monster in its path up to 100 squares away.	Produces a bolt that teleports the first monster in its path up to 100 squares away.
119	Teleport Level	Межуровневая Телепортация	Teleports you 1 level up or 1 level down (chosen at random).  This prayer has no effect when the option to restrict the use of stairs and recall is set.	Teleports you 1 level up or 1 level down (chosen at random).  This prayer has no effect when the option to restrict the use of stairs and recall is set.
120	Word of Recall	Слово Возвращения	Teleports you from the dungeon to the town or from the town to the deepest level you have visited in the dungeon.  The recall effect is not immediate; it is delayed by 14+1d20 turns.  During that delay, the spell can be canceled by invoking the prayer of recall again.  This prayer has no effect when the option to restrict the use of stairs and recall is set, unless Morgoth is dead.	Teleports you from the dungeon to the town or from the town to the deepest level you have visited in the dungeon.  The recall effect is not immediate; it is delayed by 14+1d20 turns.  During that delay, the spell can be canceled by invoking the prayer of recall again.  This prayer has no effect when the option to restrict the use of stairs and recall is set, unless Morgoth is dead.
121	Alter Reality	Изменение Мира	The current level will be discarded and a new dungeon level (on the same dungeon depth) will be generated.  This has exactly the same side effects as leaving and re-entering the level through a stair, except that you won`t start on a square with a stair.	The current level will be discarded and a new dungeon level (on the same dungeon depth) will be generated.  This has exactly the same side effects as leaving and re-entering the level through a stair, except that you won`t start on a square with a stair.
