ID	Name	Name translation	Description	Description translation
0	Magic Missile	Волшебная Стрела	Fires a magic missile that always hits its target and does unresistable damage.  Sometimes a beam is fired instead that hurts each monster in its path.  The chance to get a beam goes up with your character level.	Fires a magic missile that always hits its target and does unresistable damage.  Sometimes a beam is fired instead that hurts each monster in its path.  The chance to get a beam goes up with your character level.
1	Detect Monsters	Поиск Монстров	Detects all non-invisible monsters in the immediate area, for one turn only.	Detects all non-invisible monsters in the immediate area, for one turn only.
2	Phase Door	Фазовая Дверь	Teleports you randomly up to 10 squares away.	Teleports you randomly up to 10 squares away.
3	Light Area	Освещение	Lights up all squares in a level-dependant area, and hurts all light-sensitive monsters in the area of effect.  If you are in a room, the entire room will be lit up as well.	Lights up all squares in a level-dependant area, and hurts all light-sensitive monsters in the area of effect.  If you are in a room, the entire room will be lit up as well.
4	Find Traps, Doors & Stairs	Поиск Ловушек, Дверей и Лестниц	Detects all traps, doors, and stairs in the immediate area.	Detects all traps, doors, and stairs in the immediate area.
5	Cure Light Wounds	Лечение Легких Ран	Cures 15% of your wounds (min 15hp) and heals 20 points worth of cuts.	Cures 15% of your wounds (min 15hp) and heals 20 points worth of cuts.
6	Detect Objects	Поиск Объектов	Detects all objects in the immediate area.	Detects all objects in the immediate area.
8	Identify	Идентификация	Reveals the powers of an object.	Reveals the powers of an object.
9	Reveal Monsters	Обнаружение Монстров	Detects all monsters in the immediate area, for one turn only.	Detects all monsters in the immediate area, for one turn only.
10	Detect Treasure	Поиск Сокровищ	Detects all treasure in the immediate area.	Detects all treasure in the immediate area.
11	Stinking Cloud	Вонючее Облако	Shoots a radius-2 poison ball.	Shoots a radius-2 poison ball.
12	Lightning Bolt	Удар Молнии	Fires a lightning beam that hurts each monster in its path.	Fires a lightning beam that hurts each monster in its path.
13	Confuse Monster	Контузия Монстра	Attempts to confuse a single monster for a level-dependant duration.  Uniques and monsters that resist confusion are not affected.	Attempts to confuse a single monster for a level-dependant duration.  Uniques and monsters that resist confusion are not affected.
14	Sleep Monster	Усыпление Монстра	Attempts to put to sleep a single monster.  Uniques and monsters that resist confusion are not affected.	Attempts to put to sleep a single monster.  Uniques and monsters that resist confusion are not affected.
15	Wonder	Чудо	Invokes a random spell effect.	Invokes a random spell effect.
16	Frost Bolt	Ледяная Стрела	Fires a frost bolt that always hits its target.  Sometimes a beam is fired instead that hurts each monster in its path.  The chance to get a beam goes up with your character level.	Fires a frost bolt that always hits its target.  Sometimes a beam is fired instead that hurts each monster in its path.  The chance to get a beam goes up with your character level.
17	Acid Bolt	Кислотная Стрела	Fires an acid bolt that always hits its target.  Sometimes a beam is fired instead that hurts each monster in its path.  The chance to get a beam goes up with your character level.	Fires an acid bolt that always hits its target.  Sometimes a beam is fired instead that hurts each monster in its path.  The chance to get a beam goes up with your character level.
18	Fire Bolt	Огненная Стрела	Fires a fire bolt that always hits its target.  Sometimes a beam is fired instead that hurts each monster in its path.  The chance to get a beam goes up with your character level.	Fires a fire bolt that always hits its target.  Sometimes a beam is fired instead that hurts each monster in its path.  The chance to get a beam goes up with your character level.
19	Trap/Door Destruction	Разрушение Ловушки/Двери	Destroys all traps and doors within a 1-square radius of you.	Destroys all traps and doors within a 1-square radius of you.
20	Spear of Light	Копье Света	Fires a beam that lights up each square and hurts each light-sensitive monster in its path.	Fires a beam that lights up each square and hurts each light-sensitive monster in its path.
21	Turn Stone to Mud	Плавка Камня	Produces a beam that destroys the first section of wall it hits, unless it is a permanent wall.  Each monster caught in the beam that is susceptible to rock remover takes 20+1d30 points of damage.	Produces a beam that destroys the first section of wall it hits, unless it is a permanent wall.  Each monster caught in the beam that is susceptible to rock remover takes 20+1d30 points of damage.
22	Door Creation	Создание Дверей	A door is created on each empty floor space that is directly adjacent to you.  These doors are closed, but not locked	A door is created on each empty floor space that is directly adjacent to you.  These doors are closed, but not locked
23	Earthquake	Землетрясение	Causes a 10-square radius earthquake around you.  Earthquakes may damage monsters and destroy items in some squares in the area of effect.  Artifacts will not be destroyed by this spell.  This spell has no effect when used in the town.	Causes a 10-square radius earthquake around you.  Earthquakes may damage monsters and destroy items in some squares in the area of effect.  Artifacts will not be destroyed by this spell.  This spell has no effect when used in the town.
24	Stair Creation	Создание Лестниц	A stair (going up or down, chosen at random) is created on the space where you are standing.  This will destroy any terrain feature that was there before.  It will also destroy all items currently on the floor where the spell is cast.	A stair (going up or down, chosen at random) is created on the space where you are standing.  This will destroy any terrain feature that was there before.  It will also destroy all items currently on the floor where the spell is cast.
25	Cure Poison	Лечение Яда	Neutralizes poison.	Neutralizes poison.
26	Satisfy Hunger	Удовлетворение Голода	Magically renders you well-fed (but not satiated).  This will also cure a bloated stomach.	Magically renders you well-fed (but not satiated).  This will also cure a bloated stomach.
27	Heroism	Героизм	Cures 10 points of damage, removes fear and grants you heroism (resistance to fear, and a bonus of +12 to-hit) for 25+1d25 turns.	Cures 10 points of damage, removes fear and grants you heroism (resistance to fear, and a bonus of +12 to-hit) for 25+1d25 turns.
28	Berserker	Ярость	Cures 30 points of damage, removes fear, and grants you berserk strength (resistance to fear, a bonus of +24 to-hit, and a penalty of -10 to AC) for 25+1d25 turns.	Cures 30 points of damage, removes fear, and grants you berserk strength (resistance to fear, a bonus of +24 to-hit, and a penalty of -10 to AC) for 25+1d25 turns.
29	Haste Self	Ускорение	Hastes you (+10 to speed) for a level-dependant duration.	Hastes you (+10 to speed) for a level-dependant duration.
30	Teleport Self	Телепортация	Teleports you randomly within the current level.	Teleports you randomly within the current level.
31	Slow Monster	Замедление Монстра	Attempts to slow a single monster.  Uniques are not affected.	Attempts to slow a single monster.  Uniques are not affected.
32	Teleport Other	Телепортация Монстра	Produces a bolt that teleports the first monster in its path up to 100 squares away.	Produces a bolt that teleports the first monster in its path up to 100 squares away.
33	Teleport Level	Межуровневая Телепортация	Teleports you 1 level up or 1 level down (chosen at random).  This spell has no effect when the option to restrict the use of stairs and recall is set.	Teleports you 1 level up or 1 level down (chosen at random).  This spell has no effect when the option to restrict the use of stairs and recall is set.
34	Word of Recall	Слово Возвращения	Teleports you from the dungeon to the town or from the town to the deepest level you have visited in the dungeon.  The recall effect is not immediate; it is delayed by 14+1d20 turns.  During that delay, the spell can be canceled by invoking the spell of recall again.  This spell has no effect when the option to restrict the use of stairs and recall is set, unless Morgoth is dead.	Teleports you from the dungeon to the town or from the town to the deepest level you have visited in the dungeon.  The recall effect is not immediate; it is delayed by 14+1d20 turns.  During that delay, the spell can be canceled by invoking the spell of recall again.  This spell has no effect when the option to restrict the use of stairs and recall is set, unless Morgoth is dead.
35	Polymorph Other	Трансформация	Attempts to polymorph a single monster.  Uniques are not affected.	Attempts to polymorph a single monster.  Uniques are not affected.
36	Shock Wave	Ударная Волна	Shoots a radius-2 sound ball.  Apart from doing sound damage, this also has a chance to stun each monster in the area of effect.	Shoots a radius-2 sound ball.  Apart from doing sound damage, this also has a chance to stun each monster in the area of effect.
37	Explosion	Взрыв	Shoots a radius-2 shards ball.	Shoots a radius-2 shards ball.
38	Cloudkill	Ядовитое Облако	Shoots a radius-3 poison ball.	Shoots a radius-3 poison ball.
39	Mass Sleep	Массовое Усыпление	Attempts to put to sleep each monster within line of sight.  Uniques and monsters that resist confusion are not affected.	Attempts to put to sleep each monster within line of sight.  Uniques and monsters that resist confusion are not affected.
40	Bedlam	Бедлам	Shoots a radius-4 confusion ball that doesn`t cause physical damage but has a chance to confuse each monster in the area of effect.  Uniques or monsters that resist confusion are not affected.	Shoots a radius-4 confusion ball that doesn`t cause physical damage but has a chance to confuse each monster in the area of effect.  Uniques or monsters that resist confusion are not affected.
41	Rend Soul	Пытка Души	Fires a nether bolt that always hits its target. Does not affect undead.  Sometimes a beam is fired instead that hurts each monster in its path.  The chance to get a beam goes up with your character level.	Fires a nether bolt that always hits its target. Does not affect undead.  Sometimes a beam is fired instead that hurts each monster in its path.  The chance to get a beam goes up with your character level.
42	Word of Destruction	Слово Разрушения	Destroys everything in a 15-square radius circle around you.  All monsters, objects, and terrain features in the area of effect are destroyed, except stairs and permanent walls.  You will also be blinded for 10+1d10 turns, unless you have resistance to blindness or light.  This spell has no effect when used in the town.	Destroys everything in a 15-square radius circle around you.  All monsters, objects, and terrain features in the area of effect are destroyed, except stairs and permanent walls.  You will also be blinded for 10+1d10 turns, unless you have resistance to blindness or light.  This spell has no effect when used in the town.
43	Chaos Strike	Удар Хаоса	Fires a chaos bolt that always hits its target.  Sometimes a beam is fired instead that hurts each monster in its path.  The chance to get a beam goes up with your character level.	Fires a chaos bolt that always hits its target.  Sometimes a beam is fired instead that hurts each monster in its path.  The chance to get a beam goes up with your character level.
44	Resist Cold	Сопротивление Холоду	Grants you resistance to cold for 20+1d20 turns.	Grants you resistance to cold for 20+1d20 turns.
45	Resist Fire	Сопротивление Огню	Grants you resistance to fire for 20+1d20 turns.	Grants you resistance to fire for 20+1d20 turns.
46	Resist Poison	Сопротивление Яду	Grants you resistance to poison for 20+1d20 turns.	Grants you resistance to poison for 20+1d20 turns.
47	Resistance	Сопротивление	Grants you resistance to acid, cold, fire, lightning, and poison for 20+1d20 turns.  	Grants you resistance to acid, cold, fire, lightning, and poison for 20+1d20 turns.  
48	Shield	Щит	Grants you +50 to AC for 30+1d20 turns.	Grants you +50 to AC for 30+1d20 turns.
49	Rune of Protection	Руна Защиты	Inscribes a glyph of warding beneath you.  Summoned monsters can`t appear on the glyph.  If a monster attempts to move onto the glyph or melee you while you are standing on the glyph, it must first succeed in breaking the glyph.  Higher level monsters are more likely to break the glyph.  The glyph will remain where it is, until a monster succeeds in breaking it, or until you leave the level.	Inscribes a glyph of warding beneath you.  Summoned monsters can`t appear on the glyph.  If a monster attempts to move onto the glyph or melee you while you are standing on the glyph, it must first succeed in breaking the glyph.  Higher level monsters are more likely to break the glyph.  The glyph will remain where it is, until a monster succeeds in breaking it, or until you leave the level.
50	Lesser Recharging	Малая Перезарядка	Adds charges to a stack of wands or staves.  Chance of success and number of charges gained increase with your level and decrease with level of wand or staff and number of charges.  A failed attempt to recharge destroys one wand or staff from the stack.	Adds charges to a stack of wands or staves.  Chance of success and number of charges gained increase with your level and decrease with level of wand or staff and number of charges.  A failed attempt to recharge destroys one wand or staff from the stack.
51	Enchant Armor	Зачарование Доспехов	Attempts to improve the armour class bonus of a piece of armour.	Attempts to improve the armour class bonus of a piece of armour.
52	Enchant Weapon	Зачарование Оружия	Attempts to improve the to-hit bonus and the to-dam bonus of a weapon.	Attempts to improve the to-hit bonus and the to-dam bonus of a weapon.
53	Greater Recharging	Большая Перезарядка	Adds charges to a stack of wands or staves.  Chance of success and number of charges gained increase with your level and decrease with level of wand or staff and number of charges, but are overall much better than for the spell Lesser Recharging.  A failed attempt to recharge destroys one wand or staff from the stack.	Adds charges to a stack of wands or staves.  Chance of success and number of charges gained increase with your level and decrease with level of wand or staff and number of charges, but are overall much better than for the spell Lesser Recharging.  A failed attempt to recharge destroys one wand or staff from the stack.
54	Elemental Brand	Клеймо Элементов	Brands one stack of ammunition with fire, cold, or poison (selected at random) and at the same time attempts to improve the to-hit bonus and the to-dam bonus of the same ammunition.  The spell has no effect if the ammunition is already branded, has a slay, is broken, or is cursed.	Brands one stack of ammunition with fire, cold, or poison (selected at random) and at the same time attempts to improve the to-hit bonus and the to-dam bonus of the same ammunition.  The spell has no effect if the ammunition is already branded, has a slay, is broken, or is cursed.
55	Frost Ball	Ледяной Шар	Shoots a radius-2 frost ball.	Shoots a radius-2 frost ball.
56	Acid Ball	Кислотный Шар	Shoots a radius-2 acid ball.	Shoots a radius-2 acid ball.
57	Fire Ball	Огненный Шар	Shoots a radius-2 fire ball.	Shoots a radius-2 fire ball.
58	Ice Storm	Ледяной Шторм	Shoots a radius-3 cold ball.	Shoots a radius-3 cold ball.
59	Banishment	Изгнание	Removes all monsters represented by a chosen symbol from the level.  Uniques are not affected.  You take 1d4 points of damage for every monster removed.	Removes all monsters represented by a chosen symbol from the level.  Uniques are not affected.  You take 1d4 points of damage for every monster removed.
60	Meteor Swarm	Meteor Swarm	Shoots a swarm of 3 or 4 meteors.  Meteors will travel until hitting a wall, a monster, or reaching the target location.  Meteors will explode as a radius-1 ball that does unresistable damage to each monster in its area of effect.  If this kills the monster that blocked the path to the target location, the next meteor may continue to find another target.	Shoots a swarm of 3 or 4 meteors.  Meteors will travel until hitting a wall, a monster, or reaching the target location.  Meteors will explode as a radius-1 ball that does unresistable damage to each monster in its area of effect.  If this kills the monster that blocked the path to the target location, the next meteor may continue to find another target.
61	Mass Banishment	Поток Метеоров	Removes all monsters within 20 squares of you.  Uniques are not affected.  You take 1d3 points of damage for every monster removed.	Removes all monsters within 20 squares of you.  Uniques are not affected.  You take 1d3 points of damage for every monster removed.
62	Rift	Сдвиг	Fires a gravity beam that hurts each monster in its path and has a chance of teleporting it away.	Fires a gravity beam that hurts each monster in its path and has a chance of teleporting it away.
63	Mana Storm	Шторм Маны	Shoots a radius-3 mana ball that does unresistable damage to each monster in its area of effect.	Shoots a radius-3 mana ball that does unresistable damage to each monster in its area of effect.
64	Detect Evil	Поиск Зла	Detects all evil monsters in the immediate area, for one turn only.	Detects all evil monsters in the immediate area, for one turn only.
65	Cure Light Wounds	Лечение Легких Ран	Cures 15% of your wounds (min 15hp) and heals 20 points worth of cuts.	Cures 15% of your wounds (min 15hp) and heals 20 points worth of cuts.
66	Bless	Благословление	Blesses you, giving a bonus of +5 to AC and +10 to-hit, for 12+1d12 turns.	Blesses you, giving a bonus of +5 to AC and +10 to-hit, for 12+1d12 turns.
67	Remove Fear	Снятие Страха	Removes fear.	Removes fear.
68	Call Light	Призвать Свет	Lights up all squares in a level-dependant area, and hurts all light-sensitive monsters in the area of effect.  If you are in a room, the entire room will be lit up as well.	Lights up all squares in a level-dependant area, and hurts all light-sensitive monsters in the area of effect.  If you are in a room, the entire room will be lit up as well.
69	Find Traps, Doors & Stairs	Поиск Ловушек, Дверей и Лестниц	Detects all traps, doors, and stairs in the immediate area.	Detects all traps, doors, and stairs in the immediate area.
71	Slow Poison	Замедление Яда	Halves the remaining duration of any current poisoning.	Halves the remaining duration of any current poisoning.
72	Scare Monster	Устрашение Монстра	Attempts to scare a single monster for a level-dependant duration.  Uniques and monsters that resist fear are not affected.	Attempts to scare a single monster for a level-dependant duration.  Uniques and monsters that resist fear are not affected.
73	Portal	Портал	Teleports you randomly over a short distance.	Teleports you randomly over a short distance.
74	Cure Serious Wounds	Лечение Серьезных Ран	Cures 20% of your wounds (min 25hp) and heals all cut damage.	Cures 20% of your wounds (min 25hp) and heals all cut damage.
75	Chant	Пение	Blesses you, giving a bonus of +5 to AC and +10 to-hit, for 24+1d24 turns.	Blesses you, giving a bonus of +5 to AC and +10 to-hit, for 24+1d24 turns.
76	Sanctuary	Убежище	Attempts to put to sleep each monster directly adjacent to you.  Uniques and monsters that resist sleep are not affected.	Attempts to put to sleep each monster directly adjacent to you.  Uniques and monsters that resist sleep are not affected.
77	Satisfy Hunger	Удовлетворение Голода	Magically renders you well-fed (but not satiated).  This will also cure a bloated stomach.	Magically renders you well-fed (but not satiated).  This will also cure a bloated stomach.
79	Resist Heat and Cold	Сопротивление Огню и Холоду	Gives you temporary resistance to cold and fire, for 10+1d10 turns each.	Gives you temporary resistance to cold and fire, for 10+1d10 turns each.
80	Neutralize Poison	Нейтрализация Яда	Neutralizes poison.	Neutralizes poison.
81	Orb of Draining	Святой Огонь	Shoots a radius-2 or radius-3 ball that does unresistable damage to each monster in its area of effect.  Evil monsters take double damage.  All cursed items in the area of effect are destroyed.  The bigger area of effect is attained at character level 30.	Shoots a radius-2 or radius-3 ball that does unresistable damage to each monster in its area of effect.  Evil monsters take double damage.  All cursed items in the area of effect are destroyed.  The bigger area of effect is attained at character level 30.
82	Cure Critical Wounds	Лечение Критических Ран	Cures 25% of your wounds (min 30hp) and heals all cut damage, poison, amnesia and stunning.	Cures 25% of your wounds (min 30hp) and heals all cut damage, poison, amnesia and stunning.
83	Sense Invisible	Чувствовать Невидимое	Enables you to see invisible monsters for 24+1d24 turns.	Enables you to see invisible monsters for 24+1d24 turns.
84	Protection from Evil	Защита от Зла	Protects you from evil for a level-dependant duration: all melee attacks by evil monsters have a chance to be repelled, unless the monster`s level is higher than your character level.	Protects you from evil for a level-dependant duration: all melee attacks by evil monsters have a chance to be repelled, unless the monster`s level is higher than your character level.
85	Earthquake	Землетрясение	Causes a 10-square radius earthquake around you.  Earthquakes may damage monsters and destroy items in some squares in the area of effect.  Artifacts will not be destroyed by this prayer.  This prayer has no effect when used in the town.	Causes a 10-square radius earthquake around you.  Earthquakes may damage monsters and destroy items in some squares in the area of effect.  Artifacts will not be destroyed by this prayer.  This prayer has no effect when used in the town.
86	Sense Surroundings	Чувствовать Окружающее	Maps out a portion of the level around you.	Maps out a portion of the level around you.
87	Cure Mortal Wounds	Лечение Смертельных Ран	Cures 30% of your wounds (min 50hp), cures all stunning and heals all cut damage, poison and amnesia.	Cures 30% of your wounds (min 50hp), cures all stunning and heals all cut damage, poison and amnesia.
88	Turn Undead	Устрашение Мертвецов	Attempts to scare each undead monster within line of sight, causing it to flee in terror for a level-dependant duration.	Attempts to scare each undead monster within line of sight, causing it to flee in terror for a level-dependant duration.
89	Prayer	Молитва	Blesses you, giving a bonus of +5 to AC and +10 to-hit, for 48+1d48 turns.	Blesses you, giving a bonus of +5 to AC and +10 to-hit, for 48+1d48 turns.
90	Dispel Undead	Уничтожение Мертвецов	Inflicts unresistable damage on each undead monster within line of sight.	Inflicts unresistable damage on each undead monster within line of sight.
91	Heal	Исцеление	Cures 35% of your max hp (min 300), cures all stunning and heals all cut damage, poison and amnesia.	Cures 35% of your max hp (min 300), cures all stunning and heals all cut damage, poison and amnesia.
92	Dispel Evil	Уничтожение Зла	Inflicts unresistable damage on each evil monster within line of sight.	Inflicts unresistable damage on each evil monster within line of sight.
93	Glyph of Warding	Руна Охраны	Inscribes a glyph of warding beneath you.  Summoned monsters can`t appear on the glyph.  If a monster attempts to move onto the glyph or melee you while you are standing on the glyph, it must first succeed in breaking the glyph.  Higher level monsters are more likely to break the glyph.  The glyph will remain where it is, until a monster succeeds in breaking it, or until you leave the level.	Inscribes a glyph of warding beneath you.  Summoned monsters can`t appear on the glyph.  If a monster attempts to move onto the glyph or melee you while you are standing on the glyph, it must first succeed in breaking the glyph.  Higher level monsters are more likely to break the glyph.  The glyph will remain where it is, until a monster succeeds in breaking it, or until you leave the level.
